<?xml version="1.0" encoding="UTF-8"?>
<!-- Generated from the PDG User Interface on 5/7/2010 -->
<DesignGuideTree includeOtherBranchesFromMapper="true" xmlns:xsi="http://www.w3.org/2001/XMLSchema-instance" xsi:noNamespaceSchemaLocation="pdgui.xsd">
	<DesignGuideBranch branchLabel="Study Details" includeOtherPagesFromMapper="true" source="Config" systemName="Administrative">
		<DesignGuidePage elementType="Administrative"  includeOtherEntriesFromMapper="true" pageLabel="Identification" source="Mapper">
			<DesignGuideHeader headerLabel="Identification" helpID="2095"/>
			<DesignGuideColumnStack>
				<DesignGuideField elementPath="/FTICP/Administrative/ProtocolSkeleton/protocolID" readOnly="true"/>
				<DesignGuideField elementPath="/FTICP/Administrative/ProtocolSkeleton/phaseCoded" />
				<DesignGuideField containsMultilineText="true" elementPath="/FTICP/Administrative/ProtocolSkeleton/title/full"/>
				<DesignGuideField elementPath="/FTICP/Administrative/ProtocolSkeleton/title/brief"/>
				<DesignGuideField containsMultilineText="true" elementPath="/FTICP/Administrative/ProtocolSkeleton/description/full" fieldLabel="Description"/>
				<DesignGuideField elementPath="/FTICP/Administrative/ProtocolSkeleton/externalRegulatoryNumber"  />
				<DesignGuideField elementPath="/FTICP/Administrative/ProtocolSkeleton/otherExternalRegulatoryNumber" />
			</DesignGuideColumnStack>
			<DesignGuideColumnStack>
				<DesignGuideField controlHeight="200" elementPath="/FTICP/Administrative/ProtocolSkeleton/codedConditions" fieldClassPath="Tspd.WpfControls.GUIControls.FTListField" formatterClassPath="Tspd.WpfControls.PDG.Dialogs.Indication.IndicationFormatter">
					<DesignGuideFieldButton buttonClassPath="Tspd.WpfControls.PDG.Dialogs.Indication.IndicationLookup" buttonText="Edit"/>
				</DesignGuideField>
				<DesignGuideField containsMultilineText="true" controlHeight="200" elementPath="/FTICP/Administrative/ProtocolSkeleton/codedCountries" fieldClassPath="Tspd.WpfControls.GUIControls.FTListField" fieldLabel="Countries" formatterClassPath="Tspd.WpfControls.PDG.Dialogs.Country.CountryFormatter">
					<DesignGuideFieldButton buttonClassPath="Tspd.WpfControls.PDG.Dialogs.Country.CountryLookup" buttonText="Edit"/>
				</DesignGuideField>
			</DesignGuideColumnStack>
			<DesignGuideHeader headerLabel="Attributes" helpID="2094"/>
			<DesignGuideColumnStack>
				<DesignGuideField elementPath="/FTICP/Administrative/ProtocolSkeleton/isMultiCentered"/>
				<DesignGuideField elementPath="/FTICP/StudyDesign/Design/masking" elementType="StudyDesign"/>
				<DesignGuideField elementPath="/FTICP/StudyDesign/Design/controlType" elementType="StudyDesign"/>
				<DesignGuideField elementPath="/FTICP/StudyDesign/Design/methodOfAllocation" elementType="StudyDesign"/>
			</DesignGuideColumnStack>
			<DesignGuideColumnStack>
				<DesignGuideField elementPath="/FTICP/StudyDesign/Design/studyConfiguration" elementType="StudyDesign"/>
				<DesignGuideField elementPath="/FTICP/StudyDesign/Design/natureOfInvestigation" elementType="StudyDesign"/>
				<DesignGuideField elementPath="/FTICP/StudyDesign/Design/overallStudyOutcomeType" elementType="StudyDesign"/>
				<DesignGuideField elementPath="/FTICP/StudyDesign/Design/studyPurpose" elementType="StudyDesign"/>
			</DesignGuideColumnStack>
		</DesignGuidePage>
		<DesignGuidePage classPath="Tspd.WpfControls.PDG.Pages.PlannedMetrics.PlannedMetrics" elementType="Metrics"  source="WPF"/>
		<DesignGuidePage elementType="StudyConductCompliance"  pageLabel="Execution" source="Mapper">
			<DesignGuideHeader headerLabel="Execution" helpID="2105"/>
			<DesignGuideField elementPath="/FTICP/StudyConduct/SCG/usesIVRSType"/>
		</DesignGuidePage>
		<DesignGuidePage elementType="Organizations" helpID="2110" pageLabel="Organizations and Contacts" source="Mapper">
			<DesignGuideProtocolObject addNewButtonText="Create New Organization" dependentProtocolObjectElementPath="/FTICP/Administrative/ProtocolSkeleton/Contacts/Contact" detailHelpID="2137" elementPath="/FTICP/Administrative/ProtocolSkeleton/Organizations/Organization" helpID="2096" parentChildHelperClassPath="Tspd.WpfControls.PDG.Helpers.OrganizationHelper" source="Mapper" tableOrderingClassPath="Tspd.WpfControls.PDG.Helpers.OrganizationHelper" tableOrderingElementPath="name">
				<DesignGuideField elementPath="name" headerLabel="Name" required="true" visibleInTable="true"/>
				<DesignGuideField elementPath="organizationType" headerLabel="Type/Role" visibleInDetailPane="true" visibleInTable="true"/>
				<DesignGuideMultiField fieldLabel="Address" visibleInDetailPane="true" visibleInTable="true">
					<MultiFieldContents elementPath="Address/address1"/>
					<MultiFieldContents elementPath="Address/address2"/>
					<MultiFieldContents displayOnSameLineAsPreviousInDetails="false" elementPath="Address/city"/>
					<MultiFieldContents displayOnSameLineAsPreviousInDetails="true" displayOnSameLineAsPreviousInTable="true" elementPath="Address/stateprov" separatorBeforeFieldOnSameLine=","/>
					<MultiFieldContents displayOnSameLineAsPreviousInDetails="true" displayOnSameLineAsPreviousInTable="true" elementPath="Address/postalCode"/>
					<MultiFieldContents displayOnSameLineAsPreviousInDetails="true" displayOnSameLineAsPreviousInTable="true" elementPath="Address/country"/>
				</DesignGuideMultiField>
				<DesignGuideField elementPath="Address/address1" visibleInDetailPane="false" visibleInTable="false"/>
				<DesignGuideField elementPath="Address/address2" visibleInDetailPane="false" visibleInTable="false"/>
				<DesignGuideField elementPath="Address/city" visibleInDetailPane="false" visibleInTable="false"/>
				<DesignGuideField elementPath="Address/stateprov" visibleInDetailPane="false" visibleInTable="false"/>
				<DesignGuideField elementPath="Address/postalCode" visibleInDetailPane="false" visibleInTable="false"/>
				<DesignGuideField elementPath="Address/country" visibleInDetailPane="false" visibleInTable="false"/>
				<DesignGuideField elementPath="Address/telephone" visibleInTable="true"/>
				<DesignGuideField elementPath="Address/fax" visibleInTable="false"/>
				<DesignGuideField elementPath="custom1" visibleInDetailPane="false" visibleInEditDialog="false" visibleInTable="false"/>
				<DesignGuideField elementPath="custom2" visibleInDetailPane="false" visibleInEditDialog="false" visibleInTable="false"/>
			</DesignGuideProtocolObject>
<!-- 
			<DesignGuideField elementPath="/FTICP/Administrative/ProtocolSkeleton/versionDate" visibleInDetailPane="false"/>
			<DesignGuideField elementPath="/FTICP/Administrative/ProtocolSkeleton/versionName" />
			<DesignGuideField elementPath="/FTICP/Administrative/ProtocolSkeleton/versionType" />
			<DesignGuideField elementPath="/FTICP/Administrative/ProtocolSkeleton/description/brief" />
			<DesignGuideField elementPath="/FTICP/Administrative/ProtocolSkeleton/externalRegulatoryGrantor" />
			<DesignGuideField elementPath="/FTICP/Administrative/ProtocolSkeleton/otherExternalRegulatoryGrantor" />
			<DesignGuideField elementPath="/FTICP/Administrative/ProtocolSkeleton/one" />
			<DesignGuideField elementPath="/FTICP/Administrative/ProtocolSkeleton/two" />
			<DesignGuideField elementPath="/FTICP/Administrative/ProtocolSkeleton/three" />
                         -->
		</DesignGuidePage>
		<DesignGuidePage elementType="Contacts" helpID="2111" source="Mapper" visible="false">
			<DesignGuideProtocolObject addNewButtonText="Create New Contact" detailHelpID="2138" editDialogHelperClassPath="Tspd.WpfControls.PDG.Helpers.ContactHelper" elementPath="/FTICP/Administrative/ProtocolSkeleton/Contacts/Contact" helpID="2097" parentChildHelperClassPath="Tspd.WpfControls.PDG.Helpers.OrganizationHelper" source="Mapper" tableOrderingClassPath="Tspd.WpfControls.PDG.Helpers.OrganizationHelper">
				<DesignGuideField elementPath="personName" maxWidth="150.0" required="true" visibleInTable="true"/>
				<DesignGuideField elementPath="roleType" headerLabel="Type/Role" maxWidth="150.0" visibleInTable="true"/>
				<DesignGuideField dataType="Coded" elementPath="associatedOrganizations/associatedOrganization" enumList="_runtime" helperClassPath="Tspd.WpfControls.PDG.Helpers.ContactHelper"/>
				<DesignGuideCheckBox label="Use same address as Organization" listenerClassPath="Tspd.WpfControls.PDG.Helpers.ContactHelper"/>
				<DesignGuideMultiField fieldLabel="Address" visibleInDetailPane="true" visibleInTable="true">
					<MultiFieldContents displayOnSameLineAsPreviousInDetails="false" elementPath="Address/address1"/>
					<MultiFieldContents displayOnSameLineAsPreviousInDetails="false" elementPath="Address/address2"/>
					<MultiFieldContents displayOnSameLineAsPreviousInDetails="false" elementPath="Address/city"/>
					<MultiFieldContents displayOnSameLineAsPreviousInDetails="true" displayOnSameLineAsPreviousInTable="true" elementPath="Address/stateprov" separatorBeforeFieldOnSameLine=","/>
					<MultiFieldContents displayOnSameLineAsPreviousInDetails="true" displayOnSameLineAsPreviousInTable="true" elementPath="Address/postalCode"/>
					<MultiFieldContents displayOnSameLineAsPreviousInDetails="true" displayOnSameLineAsPreviousInTable="true" elementPath="Address/country"/>
				</DesignGuideMultiField>
				<DesignGuideField elementPath="Address/address1" visibleInDetailPane="false" visibleInTable="false"/>
				<DesignGuideField elementPath="Address/address2" visibleInDetailPane="false" visibleInTable="false"/>
				<DesignGuideField elementPath="Address/city" visibleInDetailPane="false" visibleInTable="false" shareLineInEditDialog="true"/>
				<DesignGuideField elementPath="Address/stateprov" visibleInDetailPane="false" visibleInTable="false" shareLineInEditDialog="true"/>
				<DesignGuideField elementPath="Address/postalCode" visibleInDetailPane="false" visibleInTable="false" shareLineInEditDialog="true"/>
				<DesignGuideField elementPath="Address/country" visibleInDetailPane="false" visibleInTable="false" shareLineInEditDialog="true"/>